{
  "schema_version": "1.0",
  "contract_version": "1.0.0",
  "filter_id": "experimental.venom",
  "filter_name": "Venom",
  "family_id": "experimental",
  "filter_version": "1.0.0",
  "status": "accepted",
  "implementation_class": "B",
  "creative_proposition": "Meaning turns against its scene.",
  "relationship_domains": {
    "reads": [
      "dialogue",
      "performance",
      "time"
    ],
    "changes": [
      "dialogue",
      "performance"
    ],
    "preserves": {
      "time": "Destination chronology preserved",
      "progression": "Hostility proxy never decreases"
    }
  },
  "specimen_inputs": [
    "film"
  ],
  "required_analysis": [
    "dialogue_events",
    "performances",
    "speakers"
  ],
  "candidate_generation": "A disclosed hostility term score orders source dialogue from lower to higher pressure. Candidate pools exclude unusable zero-duration dialogue.",
  "selection_rules": [
    "Lexical hostility grows monotonically through the output.",
    "Selection is deterministic for identical inputs, parameters, and random seed."
  ],
  "transformation_behavior": "A disclosed hostility term score orders source dialogue from lower to higher pressure.",
  "progression": "The emitted schedule measures the defining law at every selected output position.",
  "state_variables": [
    "parameter:intensity"
  ],
  "fields": [
    "filter_metrics",
    "filter_validation",
    "mappings"
  ],
  "controlled_uncertainty": "All tie breaking is deterministic; the recipe records the random seed even when a law needs no random choice.",
  "hard_invariants": [
    {
      "id": "proxy_is_disclosed",
      "statement": "Every mapping discloses the hostility proxy.",
      "validator": "filter_validation.proxy_is_disclosed"
    },
    {
      "id": "hostility_never_decreases",
      "statement": "Hostility proxy score never decreases through the output.",
      "validator": "filter_validation.hostility_never_decreases"
    }
  ],
  "validation": {
    "strategy": "Validate strategy-emitted invariants, measurable coverage, silence ratio, provenance, and the final audio stream.",
    "required_metrics": [
      "replacement_count",
      "silence_ratio"
    ]
  },
  "failure_behavior": "Fail before rendering when required analysis, candidate evidence, or the defining invariant is unavailable.",
  "preview_strategy": "Choose representative mappings that expose the defining law and its emitted evidence.",
  "renderer_requirements": [
    "Preserve the source picture unless the contract explicitly says otherwise.",
    "Produce a final MP4 with a verified audio stream.",
    "Report replacement-audio provenance, dialogue coverage, silence ratio, and invariant results."
  ],
  "procedure_behavior": {
    "support_status": "single_step_validated",
    "receives_transformed_specimen": false,
    "commitment": "When a Procedure runtime exists, consume prior mappings without losing immutable source provenance; this phase does not execute that commitment."
  },
  "capabilities": {
    "implemented": true,
    "implementation_key": "venom",
    "execution_mode": "scheduling_strategy",
    "sparse_schedule": true,
    "requires_speaker_identity": false,
    "supports_preview": true,
    "supports_full_length": true,
    "requires_output_acceptance": true
  },
  "blockers": []
}
