{
  "schema_version": "1.0",
  "contract_version": "1.0.0",
  "filter_id": "identity.possession",
  "filter_name": "Possession",
  "family_id": "identity",
  "filter_version": "1.0.0",
  "status": "accepted",
  "implementation_class": "A",
  "creative_proposition": "One selected possessing speaker supplies every replacement for one distinct possessed speaker throughout the run.",
  "relationship_domains": {
    "reads": [
      "dialogue",
      "performance",
      "identity",
      "time"
    ],
    "changes": [
      "dialogue",
      "identity"
    ],
    "preserves": {
      "time": "Destination chronology preserved",
      "performance": "Duration matched where possible"
    }
  },
  "specimen_inputs": [
    "film"
  ],
  "required_analysis": [
    "dialogue_events",
    "performances",
    "speakers",
    "scenes"
  ],
  "candidate_generation": "Cinelingus consistently maps lines from a possessing speaker onto windows belonging to a possessed speaker. Candidate pools exclude unusable zero-duration material.",
  "selection_rules": [
    "Cinelingus consistently maps lines from a possessing speaker onto windows belonging to a possessed speaker.",
    "Speaker pools exclude unknown_ and fallback_ identities; insufficient real speaker coverage is a hard failure.",
    "Selection is deterministic for identical inputs, parameters, and random seed."
  ],
  "transformation_behavior": "One selected possessing speaker supplies every replacement for one distinct possessed speaker throughout the run.",
  "progression": "Transformation strength is constant unless an explicit intensity parameter selects fewer windows.",
  "state_variables": [
    "parameter:possessing_speaker",
    "parameter:possessed_speaker",
    "parameter:intensity",
    "parameter:identity_stability",
    "parameter:minimum_temporal_separation",
    "parameter:performance_preservation",
    "parameter:allow_line_reuse",
    "parameter:replace_scope"
  ],
  "fields": [
    "filter_metrics",
    "filter_validation"
  ],
  "controlled_uncertainty": "Random choices are seeded and therefore reproducible.",
  "hard_invariants": [
    {
      "id": "source_identity_is_stable",
      "statement": "Source identity is stable.",
      "validator": "filter_validation.source_identity_is_stable"
    },
    {
      "id": "destination_identity_is_stable",
      "statement": "Destination identity is stable.",
      "validator": "filter_validation.destination_identity_is_stable"
    }
  ],
  "validation": {
    "strategy": "Validate strategy-emitted invariants, measurable coverage, silence ratio, provenance, and final audio stream.",
    "required_metrics": [
      "identity_consistency_rate",
      "silence_ratio"
    ]
  },
  "failure_behavior": "Fail before rendering when required inputs, analysis, candidates, or invariants are unavailable.",
  "preview_strategy": "Choose representative mappings that expose the defining law without claiming Procedure behavior.",
  "renderer_requirements": [
    "Preserve the source picture unless the contract explicitly says otherwise.",
    "Produce a final MP4 with a verified audio stream.",
    "Report replacement-audio provenance, dialogue coverage, silence ratio, and invariant results."
  ],
  "procedure_behavior": {
    "support_status": "single_step_validated",
    "receives_transformed_specimen": false,
    "commitment": "When a Procedure runtime exists, consume prior mappings without losing immutable source provenance; this phase does not execute that commitment."
  },
  "capabilities": {
    "implemented": true,
    "implementation_key": "possession",
    "execution_mode": "scheduling_strategy",
    "sparse_schedule": true,
    "requires_speaker_identity": true,
    "supports_preview": true,
    "supports_full_length": true,
    "requires_output_acceptance": true
  },
  "blockers": []
}
