{
  "schema_version": "1.0",
  "contract_version": "1.0.0",
  "filter_id": "translation.drift",
  "filter_name": "Drift",
  "family_id": "translation",
  "filter_version": "1.0.0",
  "status": "accepted",
  "implementation_class": "A",
  "creative_proposition": "Each original line is delayed by an offset that grows linearly with its source position.",
  "relationship_domains": {
    "reads": [
      "dialogue",
      "time"
    ],
    "changes": [
      "time"
    ],
    "preserves": {
      "dialogue": "Original lines",
      "identity": "Original voices",
      "performance": "Original delivery"
    }
  },
  "specimen_inputs": [
    "film"
  ],
  "required_analysis": [
    "dialogue_events"
  ],
  "candidate_generation": "Each line receives a progressively larger positive time offset across the film. Candidate pools exclude unusable zero-duration material.",
  "selection_rules": [
    "Each line receives a progressively larger positive time offset across the film.",
    "Selection is deterministic for identical inputs, parameters, and random seed."
  ],
  "transformation_behavior": "Each original line is delayed by an offset that grows linearly with its source position.",
  "progression": "Parameter-driven progression is measured in the emitted schedule.",
  "state_variables": [
    "parameter:starting_offset",
    "parameter:maximum_offset",
    "parameter:preserve_original_soundtrack"
  ],
  "fields": [
    "filter_metrics",
    "filter_validation"
  ],
  "controlled_uncertainty": "Random choices are seeded and therefore reproducible.",
  "hard_invariants": [
    {
      "id": "offset_is_non_decreasing",
      "statement": "Offset is non decreasing.",
      "validator": "filter_validation.offset_is_non_decreasing"
    },
    {
      "id": "source_line_identity_is_preserved",
      "statement": "Source line identity is preserved.",
      "validator": "filter_validation.source_line_identity_is_preserved"
    }
  ],
  "validation": {
    "strategy": "Validate strategy-emitted invariants, measurable coverage, silence ratio, provenance, and final audio stream.",
    "required_metrics": [
      "average_temporal_displacement",
      "silence_ratio"
    ]
  },
  "failure_behavior": "Fail before rendering when required inputs, analysis, candidates, or invariants are unavailable.",
  "preview_strategy": "Choose representative mappings that expose the defining law without claiming Procedure behavior.",
  "renderer_requirements": [
    "Preserve the source picture unless the contract explicitly says otherwise.",
    "Produce a final MP4 with a verified audio stream.",
    "Report replacement-audio provenance, dialogue coverage, silence ratio, and invariant results."
  ],
  "procedure_behavior": {
    "support_status": "single_step_validated",
    "receives_transformed_specimen": false,
    "commitment": "When a Procedure runtime exists, consume prior mappings without losing immutable source provenance; this phase does not execute that commitment."
  },
  "capabilities": {
    "implemented": true,
    "implementation_key": "drift",
    "execution_mode": "transformation",
    "sparse_schedule": false,
    "requires_speaker_identity": false,
    "supports_preview": true,
    "supports_full_length": true,
    "requires_output_acceptance": true
  },
  "blockers": []
}
