{
  "schema_version": "1.0",
  "contract_version": "1.0.0",
  "filter_id": "identity.chorus",
  "filter_name": "Chorus",
  "family_id": "identity",
  "filter_version": "1.0.0",
  "status": "accepted",
  "implementation_class": "A",
  "creative_proposition": "One anchor speaker supplies every replacement across a bounded set of non-anchor speakers.",
  "relationship_domains": {
    "reads": [
      "identity",
      "dialogue",
      "performance",
      "time"
    ],
    "changes": [
      "identity",
      "dialogue"
    ],
    "preserves": {
      "time": "Destination chronology preserved",
      "identity": "One stable anchor identity"
    }
  },
  "specimen_inputs": [
    "film"
  ],
  "required_analysis": [
    "dialogue_events",
    "performances",
    "speakers",
    "scenes"
  ],
  "candidate_generation": "Dialogue from one anchor speaker fills eligible windows belonging to a bounded set of other speakers. Candidate pools exclude unusable zero-duration material.",
  "selection_rules": [
    "Dialogue from one anchor speaker fills eligible windows belonging to a bounded set of other speakers.",
    "Speaker pools exclude unknown_ and fallback_ identities; insufficient real speaker coverage is a hard failure.",
    "Selection is deterministic for identical inputs, parameters, and random seed."
  ],
  "transformation_behavior": "One anchor speaker supplies every replacement across a bounded set of non-anchor speakers.",
  "progression": "Transformation strength is constant unless an explicit intensity parameter selects fewer windows.",
  "state_variables": [
    "parameter:anchor_speaker",
    "parameter:maximum_chorus_speakers",
    "parameter:intensity",
    "parameter:performance_preservation",
    "parameter:allow_line_reuse"
  ],
  "fields": [
    "filter_metrics",
    "filter_validation"
  ],
  "controlled_uncertainty": "Random choices are seeded and therefore reproducible.",
  "hard_invariants": [
    {
      "id": "all_sources_match_anchor",
      "statement": "All sources match anchor.",
      "validator": "filter_validation.all_sources_match_anchor"
    },
    {
      "id": "maximum_chorus_speakers_is_respected",
      "statement": "Maximum chorus speakers is respected.",
      "validator": "filter_validation.maximum_chorus_speakers_is_respected"
    }
  ],
  "validation": {
    "strategy": "Validate strategy-emitted invariants, measurable coverage, silence ratio, provenance, and final audio stream.",
    "required_metrics": [
      "chorus_speaker_count",
      "silence_ratio"
    ]
  },
  "failure_behavior": "Fail before rendering when required inputs, analysis, candidates, or invariants are unavailable.",
  "preview_strategy": "Choose representative mappings that expose the defining law without claiming Procedure behavior.",
  "renderer_requirements": [
    "Preserve the source picture unless the contract explicitly says otherwise.",
    "Produce a final MP4 with a verified audio stream.",
    "Report replacement-audio provenance, dialogue coverage, silence ratio, and invariant results."
  ],
  "procedure_behavior": {
    "support_status": "single_step_validated",
    "receives_transformed_specimen": false,
    "commitment": "When a Procedure runtime exists, consume prior mappings without losing immutable source provenance; this phase does not execute that commitment."
  },
  "capabilities": {
    "implemented": true,
    "implementation_key": "chorus",
    "execution_mode": "scheduling_strategy",
    "sparse_schedule": true,
    "requires_speaker_identity": true,
    "supports_preview": true,
    "supports_full_length": true,
    "requires_output_acceptance": true
  },
  "blockers": []
}
