{
  "schema_version": "1.0",
  "contract_version": "1.0.0",
  "filter_id": "multiworld.prophecy",
  "filter_name": "Prophecy",
  "family_id": "multiworld",
  "filter_version": "1.0.0",
  "status": "accepted",
  "implementation_class": "F",
  "creative_proposition": "Later normalized dialogue from one film predicts earlier positions in the anchor film.",
  "relationship_domains": {
    "reads": [
      "dialogue",
      "time",
      "scene_order"
    ],
    "changes": [
      "dialogue",
      "time",
      "scene_order"
    ],
    "preserves": {
      "time": "Anchor chronology is preserved",
      "provenance": "Normalized positions and lead are emitted"
    }
  },
  "specimen_inputs": [
    "films"
  ],
  "required_analysis": [
    "film_inspections",
    "shared_timeline",
    "world_model"
  ],
  "candidate_generation": "A donor line is eligible only when its normalized source position leads the anchor destination by the configured minimum. Every candidate retains its source film ID and media hash.",
  "selection_rules": [
    "Later normalized dialogue from one film predicts earlier positions in the anchor film.",
    "Selection is deterministic for identical films, parameters, and random seed."
  ],
  "transformation_behavior": "A donor line is eligible only when its normalized source position leads the anchor destination by the configured minimum.",
  "progression": "The schedule emits film, phase, layer, or normalized-time evidence for every placement.",
  "state_variables": [
    "parameter:minimum_normalized_lead",
    "parameter:intensity",
    "anchor_film_id",
    "source_film_id",
    "source_media_hash"
  ],
  "fields": [
    "filter_metrics",
    "filter_validation",
    "mappings",
    "multiworld"
  ],
  "controlled_uncertainty": "All film ordering, candidate ranking, and tie breaking are deterministic; the recipe records the seed.",
  "hard_invariants": [
    {
      "id": "every_prophecy_source_is_in_the_normalized_future",
      "statement": "Every prophecy source leads its anchor destination in normalized time.",
      "validator": "filter_validation.every_prophecy_source_is_in_the_normalized_future"
    },
    {
      "id": "every_source_comes_from_prophetic_film",
      "statement": "Every prophecy source comes from the donor film.",
      "validator": "filter_validation.every_source_comes_from_prophetic_film"
    },
    {
      "id": "anchor_timeline_is_preserved",
      "statement": "Every placement remains on the anchor timeline.",
      "validator": "filter_validation.anchor_timeline_is_preserved"
    }
  ],
  "validation": {
    "strategy": "Validate cinematic-law invariants, per-film provenance, measurable coverage, silence ratio, and the final audio stream.",
    "required_metrics": [
      "replacement_count",
      "contributing_films",
      "silence_ratio"
    ]
  },
  "failure_behavior": "Fail before rendering when film count, analysis, contributing-film evidence, candidates, or cinematic-law invariants are unavailable.",
  "preview_strategy": "Full-length execution is supported in this phase; preview remains unavailable until multi-film reel selection preserves all law invariants.",
  "renderer_requirements": [
    "Preserve Film A picture and chronology.",
    "Render every replacement from its declared source film cache.",
    "Produce a final MP4 with verified audio, coverage, silence, and multi-film provenance."
  ],
  "procedure_behavior": {
    "support_status": "single_step_validated",
    "receives_transformed_specimen": false,
    "commitment": "When a Procedure runtime exists, consume the complete world model and prior mappings without losing immutable per-film provenance."
  },
  "capabilities": {
    "implemented": true,
    "implementation_key": "multiworld_prophecy",
    "execution_mode": "transformation",
    "sparse_schedule": true,
    "requires_speaker_identity": false,
    "supports_preview": false,
    "supports_full_length": true,
    "requires_output_acceptance": true
  },
  "blockers": [],
  "multiworld_contract": {
    "cinematic_law": "Temporal Exchange",
    "minimum_films": 2,
    "maximum_films": 2,
    "anchor_behavior": "anchor_timeline",
    "affected_elements": [
      "dialogue",
      "time",
      "scene_order"
    ],
    "quality_requirements": [
      "Cinematic-law invariants pass",
      "Output provenance names every contributing film"
    ],
    "deterministic_seed_support": true,
    "interface": {
      "inputs": [
        "films"
      ],
      "outputs": [
        "rendered_film"
      ],
      "affected_artifacts": [
        "shared_timeline",
        "world_model",
        "replacement_decisions"
      ],
      "intermediate_products": [
        "film_inspections",
        "shared_timeline",
        "world_model",
        "replacement_decisions",
        "filter_plan"
      ]
    }
  }
}
