{"schema_version":"1.0","contract_version":"1.0.0","filter_id":"multiworld.wormhole","filter_name":"Wormhole","family_id":"multiworld","filter_version":"1.0.0","status":"blocked","implementation_class":"F","creative_proposition":"Selected moments cross between films through deterministic temporal portals.","relationship_domains":{"reads":["time","scene_order","shot_selection"],"changes":["time","scene_order","shot_selection"],"preserves":{}},"specimen_inputs":["films"],"required_analysis":["film_inspections","shared_timeline","world_model"],"capabilities":{"implemented":false,"implementation_key":null,"execution_mode":"unavailable","sparse_schedule":false,"requires_speaker_identity":false,"supports_preview":false,"supports_full_length":false,"requires_output_acceptance":false},"blockers":["This filter is not yet implemented."],"multiworld_contract":{"cinematic_law":"Temporal Exchange","minimum_films":2,"maximum_films":null,"anchor_behavior":"anchor_timeline","affected_elements":["time","scene_order","shot_selection"],"quality_requirements":["Cinematic-law invariants pass","Output provenance names every contributing film"],"deterministic_seed_support":true,"interface":{"inputs":["films"],"outputs":["rendered_film"],"affected_artifacts":["shared_timeline","world_model","replacement_decisions"],"intermediate_products":["film_inspections","shared_timeline","world_model","replacement_decisions","filter_plan"]}}}
