{"schema_version":"1.0","contract_version":"1.0.0","filter_id":"multiworld.chimera","filter_name":"Chimera","family_id":"multiworld","filter_version":"1.0.0","status":"blocked","implementation_class":"F","creative_proposition":"Three films combine into one hybrid cinematic organism.","relationship_domains":{"reads":["dialogue","identity","music","soundscape","genre"],"changes":["dialogue","identity","music","soundscape","genre"],"preserves":{}},"specimen_inputs":["films"],"required_analysis":["film_inspections","shared_timeline","world_model"],"capabilities":{"implemented":false,"implementation_key":null,"execution_mode":"unavailable","sparse_schedule":false,"requires_speaker_identity":false,"supports_preview":false,"supports_full_length":false,"requires_output_acceptance":false},"blockers":["This filter is not yet implemented."],"multiworld_contract":{"cinematic_law":"Genre Mutation","minimum_films":3,"maximum_films":3,"anchor_behavior":"anchor_timeline","affected_elements":["dialogue","identity","music","soundscape","genre"],"quality_requirements":["Cinematic-law invariants pass","Output provenance names every contributing film"],"deterministic_seed_support":true,"interface":{"inputs":["films"],"outputs":["rendered_film"],"affected_artifacts":["shared_timeline","world_model","replacement_decisions"],"intermediate_products":["film_inspections","shared_timeline","world_model","replacement_decisions","filter_plan"]}}}
