{
  "schema_version": "1.0",
  "contract_version": "1.0.0",
  "filter_id": "multiworld.translation",
  "filter_name": "Translation",
  "family_id": "multiworld",
  "filter_version": "1.0.0",
  "status": "accepted",
  "implementation_class": "A",
  "creative_proposition": "Dialogue from a donor film fills speaking windows in the anchor film while anchor picture and chronology remain fixed.",
  "relationship_domains": {
    "reads": ["dialogue", "performance", "identity", "time"],
    "changes": ["dialogue", "identity", "performance"],
    "preserves": {"time": "Anchor chronology preserved", "performance": "Matched where possible"}
  },
  "specimen_inputs": ["films"],
  "required_analysis": ["dialogue_events", "performances", "speakers", "scenes", "shots"],
  "candidate_generation": "Donor performances fill anchor speaking windows using duration, rhythm, scene, and speaker compatibility. Candidate pools exclude unusable zero-duration material.",
  "selection_rules": [
    "Donor performances fill anchor speaking windows using duration, rhythm, scene, and speaker compatibility.",
    "Selection is deterministic for identical films, parameters, and random seed."
  ],
  "transformation_behavior": "Dialogue from the donor film fills anchor speaking windows while anchor picture and chronology remain fixed.",
  "progression": "Transformation strength is constant unless an explicit intensity parameter selects fewer windows.",
  "state_variables": ["parameter:intensity", "parameter:performance_preservation"],
  "fields": ["filter_metrics", "filter_validation"],
  "controlled_uncertainty": "Random choices are seeded and therefore reproducible.",
  "hard_invariants": [
    {"id": "all_enabled_clips_come_from_source_media", "statement": "All enabled clips come from donor media.", "validator": "filter_validation.all_enabled_clips_come_from_source_media"},
    {"id": "destination_chronology_is_preserved", "statement": "Anchor chronology is preserved.", "validator": "filter_validation.destination_chronology_is_preserved"},
    {"id": "source_dialogue_is_not_reused", "statement": "Each donor dialogue clip is used at most once.", "validator": "filter_validation.source_dialogue_is_not_reused"}
  ],
  "validation": {"strategy": "Validate strategy-emitted invariants, measurable coverage, silence ratio, provenance, and final audio stream.", "required_metrics": ["dialogue_coverage", "silence_ratio"]},
  "failure_behavior": "Fail before rendering when required films, analysis, candidates, or invariants are unavailable.",
  "preview_strategy": "Choose representative mappings that expose Translation without claiming Procedure behavior.",
  "renderer_requirements": ["Preserve anchor picture.", "Produce a final MP4 with a verified audio stream.", "Report replacement-audio provenance, dialogue coverage, silence ratio, and invariant results."],
  "procedure_behavior": {"support_status": "single_step_validated", "receives_transformed_specimen": false, "commitment": "Expose typed inputs, outputs, affected artifacts, and intermediate products without executing multi-step Procedures."},
  "capabilities": {"implemented": true, "implementation_key": "translation", "execution_mode": "transformation", "sparse_schedule": false, "requires_speaker_identity": false, "supports_preview": true,  "supports_full_length": true, "requires_output_acceptance": true},
  "blockers": [],
  "multiworld_contract": {
    "cinematic_law": "Translation",
    "minimum_films": 2,
    "maximum_films": 2,
    "anchor_behavior": "anchor_timeline",
    "affected_elements": ["dialogue", "identity", "performance"],
    "quality_requirements": ["Dialogue coverage passes", "Silence ratio passes", "Audio provenance passes", "Contract invariants pass"],
    "deterministic_seed_support": true,
    "interface": {
      "inputs": ["films"],
      "outputs": ["replacement_dialogue", "rendered_film"],
      "affected_artifacts": ["dialogue_events", "performances", "speakers", "scenes", "shots", "shared_timeline"],
      "intermediate_products": ["film_inspections", "shared_timeline", "world_model", "replacement_decisions", "filter_plan"]
    }
  }
}
